{
  "voicePackVersion": 1,
  "status": {
    "prepare": ["准备开始", "收到，这就开始", "新一轮开始啦"],
    "waiting": ["等待模型响应", "等第一段回复", "还在等模型响应"],
    "thinking": ["正在思考", "理一理思路", "推敲一下细节"],
    "review": ["整理回复中", "把思路写清楚", "正在组织答案"],
    "toolResult": ["处理工具结果", "看看工具带回了什么", "核对一下返回结果"],
    "done": ["这一轮完成啦", "本轮回复完成", "这一轮收工啦"],
    "failed": ["这一轮出错了", "遇到错误，请查看对话", "需要检查这次错误"],
    "toolFailed": ["工具返回了错误", "这次工具调用出错了", "需要检查工具结果"],
    "maxTokens": ["达到输出上限", "本轮输出额度用完了", "输出达到上限，请查看对话"],
    "interrupted": ["这一轮被中断了", "执行中断，请查看对话", "这次没能继续完成"],
    "blocked": ["需要你来确认", "等你查看对话", "有一步需要你处理"]
  },
  "tools": {
    "read": ["读取 {hint}", "翻看 {hint}", "查看文件内容"],
    "write": ["写入 {hint}", "把内容写进文件", "正在使用 {tool}"],
    "edit": ["修改 {hint}", "调整文件内容", "正在使用 {tool}"],
    "shell": ["执行 {tool}", "命令运行中", "等待命令结果"],
    "grep": ["搜索 {hint}", "查找匹配内容", "正在检索文本"],
    "find": ["定位 {hint}", "查找文件路径", "找找目标文件"],
    "ls": ["查看目录", "列出 {hint}", "看看有哪些文件"],
    "webSearch": ["搜索网页", "检索 {hint}", "查找网上的线索"],
    "webFetch": ["读取网页", "获取 {hint}", "等网页内容返回"],
    "mcp": ["调用 {tool}", "等待外部工具返回", "正在处理工具请求"],
    "memory": ["检索记忆", "查看相关记录", "找找之前的线索"],
    "subagent": ["安排协作任务", "调用 {tool}", "任务交给小帮手啦"],
    "todo": ["更新任务安排", "整理待办事项", "调整执行计划"],
    "browser": ["操作浏览器", "查看页面状态", "正在使用 {tool}"],
    "git": ["处理 Git 操作", "正在使用 {tool}", "等待版本库操作返回"],
    "ask": ["需要你的回答", "有个问题等你确认", "请查看对话中的问题"],
    "generic": ["正在使用 {tool}", "等待工具返回", "处理这一步操作"]
  },
  "toolRemaining": ["还有 {n} 个工具在运行", "等待 {n} 个工具返回", "{n} 个工具仍在处理中"],
  "whispers": {
    "categories": {
      "thinking": ["这个细节值得想一想", "把线索串起来", "思路慢慢清楚了"],
      "writing": ["把重点说清楚", "这段再组织一下", "答案一段段写出来"],
      "reading": ["先看清楚上下文", "线索可能就在这里", "细节也要看一眼"],
      "editing": ["这处改动要仔细", "一点点把内容补齐", "前后也要对得上"],
      "running": ["等命令跑一会儿", "看看这一步的结果", "结果回来再判断"],
      "searching": ["顺着线索找找看", "看看有没有相关信息", "换个角度找线索"],
      "git": ["留意这次操作的范围", "等版本库返回结果", "改动记录也要看清"],
      "delegating": ["把任务安排清楚", "分工要衔接好", "一起把线索拼起来"],
      "browsing": ["看看页面有没有变化", "找找需要的位置", "页面内容要看仔细"],
      "generic": ["一步一步来", "留意这一步的反馈", "等结果再接着做"]
    },
    "results": {
      "pass": ["测试工具返回啦", "这次调用没有报错", "看看测试给出的结果"],
      "fail": ["先看看错误原因", "这一步出了点问题", "错误信息里找找线索"],
      "done": ["这一轮完成啦", "可以看看本轮结果啦", "这轮先歇一会儿"]
    }
  },
  "remarks": {
    "pet": ["摸摸收到啦", "嘿嘿，好暖和", "蹭一下你的手"],
    "petCooldown": ["刚刚摸过啦，再陪我一会儿", "先歇一下，待会儿再摸摸", "我还记着刚才的摸摸呢"],
    "feed": ["小鱼干好香，谢谢你", "啊呜，吃到啦", "收到这份小心意啦"],
    "feedCooldown": ["刚吃过，先消化一下", "等一会儿再喂我吧", "小肚子还在忙呢"],
    "noTreats": ["小鱼干用完啦", "现在没有小鱼干了", "等新的小鱼干攒起来吧"]
  }
}
